{
  "mechanism_id": "MECH-3-debt-oscillation-weak",
  "asserted_verdict": "PARTLY_HOLDS",
  "scope": "audit_only_falsification_not_operationalization",
  "interpretation": "A high-debt fixture classifies turbulent via the flow-regime Lorenz lens, but the sharp 90% causal cliff is refuted (Herndon-Ash-Pollin 2013)."
}
